{
  "$schema": "https://json-schema.org/draft/2020-12/schema",
  "$id": "https://www.moraltrade.org/schemas/moral-trade/externality-profile.schema.json",
  "title": "Moral Trade Externality Profile",
  "type": "object",
  "required": [
    "version",
    "purpose",
    "dueDiligenceSteps",
    "triggerCodes",
    "reviewStandards",
    "triggerStandardMatrix",
    "remedyControls",
    "allowedOutcomes",
    "externalityTests"
  ],
  "properties": {
    "version": { "type": "string", "minLength": 1 },
    "purpose": { "type": "string", "minLength": 1 },
    "dueDiligenceSteps": {
      "type": "array",
      "minItems": 6,
      "items": {
        "type": "object",
        "required": ["key", "label", "rule"],
        "properties": {
          "key": { "type": "string", "minLength": 1 },
          "label": { "type": "string", "minLength": 1 },
          "rule": { "type": "string", "minLength": 1 }
        },
        "additionalProperties": false
      }
    },
    "triggerCodes": {
      "type": "array",
      "minItems": 6,
      "items": {
        "type": "object",
        "required": ["key", "label", "rule"],
        "properties": {
          "key": { "type": "string", "minLength": 1 },
          "label": { "type": "string", "minLength": 1 },
          "rule": { "type": "string", "minLength": 1 }
        },
        "additionalProperties": false
      }
    },
    "reviewStandards": {
      "type": "array",
      "minItems": 5,
      "items": {
        "type": "object",
        "required": ["key", "label", "scope"],
        "properties": {
          "key": { "type": "string", "minLength": 1 },
          "label": { "type": "string", "minLength": 1 },
          "scope": { "type": "string", "minLength": 1 }
        },
        "additionalProperties": false
      }
    },
    "triggerStandardMatrix": {
      "type": "array",
      "minItems": 6,
      "items": {
        "type": "object",
        "required": ["triggerCode", "requiredStandards", "evidenceExpectations"],
        "properties": {
          "triggerCode": { "type": "string", "minLength": 1 },
          "requiredStandards": {
            "type": "array",
            "minItems": 1,
            "items": { "type": "string", "minLength": 1 },
            "uniqueItems": true
          },
          "evidenceExpectations": {
            "type": "array",
            "minItems": 1,
            "items": { "type": "string", "minLength": 1 },
            "uniqueItems": true
          }
        },
        "additionalProperties": false
      }
    },
    "remedyControls": {
      "type": "array",
      "minItems": 4,
      "items": {
        "type": "object",
        "required": ["key", "label", "rule"],
        "properties": {
          "key": { "type": "string", "minLength": 1 },
          "label": { "type": "string", "minLength": 1 },
          "rule": { "type": "string", "minLength": 1 }
        },
        "additionalProperties": false
      }
    },
    "allowedOutcomes": {
      "type": "array",
      "minItems": 4,
      "items": { "type": "string", "minLength": 1 },
      "uniqueItems": true
    },
    "externalityTests": {
      "type": "array",
      "minItems": 4,
      "items": { "type": "string", "minLength": 1 },
      "uniqueItems": true
    }
  },
  "additionalProperties": false
}
